{
  "$schema": "../../System-References/Schemas/stage-5-manifest.schema.json",
  "format_version": "2.0",
  "artifact_id": "ARTIFACT-S5-MANIFEST",
  "artifact_type": "stage_manifest",
  "stage": "Stage 5",
  "status": "ready_for_stage_6",
  "context_ref": "Build-Plans/Stage-5/00-stage-context.json",
  "artifacts": [
    {
      "artifact_id": "ARTIFACT-S5-ROADMAP",
      "artifact_type": "development_roadmap",
      "path": "Build-Plans/Stage-5/01-development-roadmap.json",
      "data_path": "/data/development_roadmap",
      "schema_ref": "System-References/Schemas/stage-5-artifact.schema.json"
    },
    {
      "artifact_id": "ARTIFACT-S5-SEQUENCE",
      "artifact_type": "implementation_sequence",
      "path": "Build-Plans/Stage-5/02-implementation-sequence.json",
      "data_path": "/data/implementation_sequence",
      "schema_ref": "System-References/Schemas/stage-5-artifact.schema.json"
    },
    {
      "artifact_id": "ARTIFACT-S5-DEPENDENCIES",
      "artifact_type": "engineering_dependencies",
      "path": "Build-Plans/Stage-5/03-engineering-dependencies.json",
      "data_path": "/data/engineering_dependencies",
      "schema_ref": "System-References/Schemas/stage-5-artifact.schema.json"
    },
    {
      "artifact_id": "ARTIFACT-S5-TESTING",
      "artifact_type": "testing_strategy",
      "path": "Build-Plans/Stage-5/04-testing-strategy.json",
      "data_path": "/data/testing_strategy",
      "schema_ref": "System-References/Schemas/stage-5-artifact.schema.json"
    },
    {
      "artifact_id": "ARTIFACT-S5-TICKETS",
      "artifact_type": "build_tickets",
      "path": "Build-Plans/Stage-5/05-build-tickets.json",
      "data_path": "/data/tickets",
      "schema_ref": "System-References/Schemas/stage-5-artifact.schema.json"
    },
    {
      "artifact_id": "ARTIFACT-S5-ASSIGNMENTS",
      "artifact_type": "agent_assignment_plan",
      "path": "Build-Plans/Stage-5/06-agent-assignment-plan.json",
      "data_path": "/data/agents",
      "schema_ref": "System-References/Schemas/stage-5-artifact.schema.json"
    },
    {
      "artifact_id": "ARTIFACT-S5-PARALLEL",
      "artifact_type": "parallel_execution_plan",
      "path": "Build-Plans/Stage-5/07-parallel-execution-plan.json",
      "data_path": "/data/batches",
      "schema_ref": "System-References/Schemas/stage-5-artifact.schema.json"
    },
    {
      "artifact_id": "ARTIFACT-S5-RELEASE",
      "artifact_type": "release_plan",
      "path": "Build-Plans/Stage-5/08-release-plan.json",
      "data_path": "/data/release_plan",
      "schema_ref": "System-References/Schemas/stage-5-artifact.schema.json"
    }
  ],
  "stage_6_handoff": {
    "source_stage": "Stage 5",
    "target_stage": "Stage 6",
    "source_output_directory": "Build-Plans/Stage-5",
    "manifest": "Build-Plans/Stage-5/09-stage-manifest.json",
    "context": "Build-Plans/Stage-5/00-stage-context.json",
    "required_files": [
      "Build-Plans/Stage-5/00-stage-context.json",
      "Build-Plans/Stage-5/01-development-roadmap.json",
      "Build-Plans/Stage-5/02-implementation-sequence.json",
      "Build-Plans/Stage-5/03-engineering-dependencies.json",
      "Build-Plans/Stage-5/04-testing-strategy.json",
      "Build-Plans/Stage-5/05-build-tickets.json",
      "Build-Plans/Stage-5/06-agent-assignment-plan.json",
      "Build-Plans/Stage-5/07-parallel-execution-plan.json",
      "Build-Plans/Stage-5/08-release-plan.json",
      "Build-Plans/Stage-5/09-stage-manifest.json"
    ],
    "ready": true,
    "blocking_items": [],
    "accepted_risks": [
      "RISK-001",
      "RISK-005",
      "RISK-010",
      "UX-RISK-001",
      "UX-RISK-002"
    ],
    "traceability_refs": [
      "FEATURE-001",
      "FEATURE-002",
      "FEATURE-003",
      "FEATURE-004",
      "FEATURE-005",
      "FEATURE-010",
      "FEATURE-013",
      "FEATURE-014",
      "FEATURE-015",
      "WORKFLOW-001",
      "WORKFLOW-002",
      "WORKFLOW-003",
      "WORKFLOW-007",
      "WORKFLOW-006",
      "WORKFLOW-014",
      "SLICE-001",
      "SLICE-002",
      "SLICE-003",
      "SLICE-004",
      "SLICE-005",
      "SLICE-006",
      "SLICE-007",
      "SLICE-008",
      "SLICE-009",
      "SLICE-010",
      "SLICE-011",
      "SLICE-012",
      "SLICE-013",
      "SLICE-014",
      "SLICE-015",
      "TICKET-001",
      "TICKET-002",
      "TICKET-003",
      "TICKET-004",
      "TICKET-005",
      "TICKET-006",
      "TICKET-007",
      "TICKET-008",
      "TICKET-009",
      "TICKET-010",
      "TICKET-011",
      "TICKET-012",
      "TICKET-013",
      "TICKET-014",
      "TICKET-015",
      "TICKET-016",
      "TICKET-017",
      "TICKET-018",
      "TICKET-019",
      "TICKET-020",
      "TICKET-021",
      "AGENT-FOUNDATION",
      "AGENT-BACKEND",
      "AGENT-WORKER",
      "AGENT-FRONTEND",
      "AGENT-VALIDATION",
      "BATCH-001",
      "BATCH-002",
      "BATCH-003",
      "BATCH-004",
      "BATCH-005",
      "BATCH-006",
      "BATCH-007"
    ],
    "completion_status": {
      "stage_specific_status": "ready_for_stage_6",
      "global_status": "ready_for_next_stage",
      "reason": "All Stage 5 orchestration outputs, dependency-aware tickets, required skill chains, generated agent profiles, parallel batches, release gates, expected artifacts, and Stage 6 handoff are complete.",
      "blocking_items": [],
      "next_actions": [
        "Run Stage 6 implementation and validation using BATCH-001 through BATCH-007."
      ],
      "ready_for": "Stage 6 (Implementation & Validation)"
    },
    "execution_queue": [
      "TICKET-001",
      "TICKET-002",
      "TICKET-003",
      "TICKET-004",
      "TICKET-005",
      "TICKET-006",
      "TICKET-007",
      "TICKET-008",
      "TICKET-009",
      "TICKET-010",
      "TICKET-011",
      "TICKET-012",
      "TICKET-013",
      "TICKET-014",
      "TICKET-015",
      "TICKET-016",
      "TICKET-017",
      "TICKET-018",
      "TICKET-019",
      "TICKET-020",
      "TICKET-021"
    ],
    "batch_order": [
      "BATCH-001",
      "BATCH-002",
      "BATCH-003",
      "BATCH-004",
      "BATCH-005",
      "BATCH-006",
      "BATCH-007"
    ],
    "required_agent_files": [
      ".opencode/agents/stage6-foundation-agent.md",
      ".opencode/agents/stage6-backend-agent.md",
      ".opencode/agents/stage6-worker-agent.md",
      ".opencode/agents/stage6-frontend-agent.md",
      ".opencode/agents/stage6-validation-agent.md"
    ]
  },
  "completion_status": {
    "stage_specific_status": "ready_for_stage_6",
    "global_status": "ready_for_next_stage",
    "reason": "All Stage 5 orchestration outputs, dependency-aware tickets, required skill chains, generated agent profiles, parallel batches, release gates, expected artifacts, and Stage 6 handoff are complete.",
    "blocking_items": [],
    "next_actions": [
      "Run Stage 6 implementation and validation using BATCH-001 through BATCH-007."
    ],
    "ready_for": "Stage 6 (Implementation & Validation)"
  },
  "schema_validation": {
    "schema_refs": [
      "System-References/Schemas/stage-5-context.schema.json",
      "System-References/Schemas/stage-5-artifact.schema.json",
      "System-References/Schemas/stage-5-manifest.schema.json"
    ],
    "validated_files": [
      "Build-Plans/Stage-5/00-stage-context.json",
      "Build-Plans/Stage-5/01-development-roadmap.json",
      "Build-Plans/Stage-5/02-implementation-sequence.json",
      "Build-Plans/Stage-5/03-engineering-dependencies.json",
      "Build-Plans/Stage-5/04-testing-strategy.json",
      "Build-Plans/Stage-5/05-build-tickets.json",
      "Build-Plans/Stage-5/06-agent-assignment-plan.json",
      "Build-Plans/Stage-5/07-parallel-execution-plan.json",
      "Build-Plans/Stage-5/08-release-plan.json",
      "Build-Plans/Stage-5/09-stage-manifest.json"
    ],
    "schema_errors": [],
    "schemas_valid": true,
    "validated_at": "2026-07-25T01:39:56.001811+00:00",
    "validator": "Stage 5 v2 structural validator",
    "blocking": true
  }
}
